[
  {
    "id": "G1",
    "term": "IRR (Internal Rate of Return)",
    "aliases": [
      "Internal Rate of Return"
    ],
    "quick_definition": "The annualized, time-weighted rate that discounts a fund's or deal's cash flows to zero — PE's headline return number.",
    "home_module": "private-equity",
    "home_zone": "Z5",
    "contributed_by": "private-equity",
    "category": "Returns & Performance metrics",
    "appears_in": [
      "Z1",
      "Z2",
      "Z3",
      "Z4",
      "Z5"
    ],
    "disambiguate_with": [],
    "status": "mapped"
  },
  {
    "id": "G2",
    "term": "MOIC / Multiple of Money",
    "aliases": [],
    "quick_definition": "The absolute multiple capital returns — total value ÷ capital invested (e.g., 2.5×); ignores time.",
    "home_module": "private-equity",
    "home_zone": "Z5",
    "contributed_by": "private-equity",
    "category": "Returns & Performance metrics",
    "appears_in": [
      "Z1",
      "Z2",
      "Z3",
      "Z4",
      "Z5"
    ],
    "disambiguate_with": [],
    "status": "mapped"
  },
  {
    "id": "G3",
    "term": "DPI / RVPI / TVPI",
    "aliases": [],
    "quick_definition": "The three multiples splitting fund value into cash already returned (DPI), value still held (RVPI), and the sum (TVPI).",
    "home_module": "private-equity",
    "home_zone": "Z5",
    "contributed_by": "private-equity",
    "category": "Returns & Performance metrics",
    "appears_in": [
      "Z1",
      "Z5"
    ],
    "disambiguate_with": [],
    "status": "mapped"
  },
  {
    "id": "G4",
    "term": "J-curve",
    "aliases": [],
    "quick_definition": "The shape of an LP's cumulative net cash flow — negative early (fees + drawdowns), turning positive as exits return capital.",
    "home_module": "private-equity",
    "home_zone": "Z1",
    "contributed_by": "private-equity",
    "category": "Returns & Performance metrics",
    "appears_in": [
      "Z1",
      "Z4",
      "Z5"
    ],
    "disambiguate_with": [],
    "status": "mapped"
  },
  {
    "id": "G5",
    "term": "PME (Public Market Equivalent)",
    "aliases": [
      "Public Market Equivalent"
    ],
    "quick_definition": "A benchmark comparing a fund's return to what the same cash flows would have earned in a public index.",
    "home_module": "private-equity",
    "home_zone": "Z5",
    "contributed_by": "private-equity",
    "category": "Returns & Performance metrics",
    "appears_in": [
      "Z5"
    ],
    "disambiguate_with": [],
    "status": "mapped"
  },
  {
    "id": "G6",
    "term": "GP (General Partner)",
    "aliases": [
      "General Partner"
    ],
    "quick_definition": "The fund's manager — makes all investment decisions, owes a fiduciary duty to LPs, and bears unlimited liability.",
    "home_module": "private-equity",
    "home_zone": "Z1",
    "contributed_by": "private-equity",
    "category": "Fund economics & structure",
    "appears_in": [
      "all zones"
    ],
    "disambiguate_with": [],
    "status": "mapped"
  },
  {
    "id": "G7",
    "term": "LP (Limited Partner)",
    "aliases": [
      "Limited Partner"
    ],
    "quick_definition": "A passive investor in the fund whose liability is capped at its committed capital.",
    "home_module": "private-equity",
    "home_zone": "Z1",
    "contributed_by": "private-equity",
    "category": "Fund economics & structure",
    "appears_in": [
      "all zones"
    ],
    "disambiguate_with": [],
    "status": "mapped"
  },
  {
    "id": "G8",
    "term": "Management fee",
    "aliases": [],
    "quick_definition": "The annual fee (~1.3–2.5% of committed, then invested, capital) paid to the manager to run the fund.",
    "home_module": "private-equity",
    "home_zone": "Z1",
    "contributed_by": "private-equity",
    "category": "Fund economics & structure",
    "appears_in": [
      "Z1",
      "Z5"
    ],
    "disambiguate_with": [],
    "status": "mapped"
  },
  {
    "id": "G9",
    "term": "\"2 and 20\"",
    "aliases": [],
    "quick_definition": "The standard PE comp model: ~2% management fee + 20% of profits (carry) to the GP.",
    "home_module": "private-equity",
    "home_zone": "Z1",
    "contributed_by": "private-equity",
    "category": "Fund economics & structure",
    "appears_in": [
      "Z1",
      "Z5"
    ],
    "disambiguate_with": [],
    "status": "mapped"
  },
  {
    "id": "G10",
    "term": "Carried interest (\"carry\")",
    "aliases": [
      "\"carry\""
    ],
    "quick_definition": "The GP's ~20% share of net fund profits — the main performance incentive.",
    "home_module": "private-equity",
    "home_zone": "Z1",
    "contributed_by": "private-equity",
    "category": "Fund economics & structure",
    "appears_in": [
      "Z1",
      "Z4",
      "Z5"
    ],
    "disambiguate_with": [],
    "status": "mapped"
  },
  {
    "id": "G11",
    "term": "Distribution waterfall",
    "aliases": [],
    "quick_definition": "The contractual order proceeds flow back: return capital → preferred return → GP catch-up → split profits.",
    "home_module": "private-equity",
    "home_zone": "Z5",
    "contributed_by": "private-equity",
    "category": "Fund economics & structure",
    "appears_in": [
      "Z1",
      "Z2",
      "Z4",
      "Z5"
    ],
    "disambiguate_with": [],
    "status": "mapped"
  },
  {
    "id": "G12",
    "term": "Hurdle rate / Preferred return",
    "aliases": [],
    "quick_definition": "The minimum annual return (typically 8%) LPs must get before the GP earns carry.",
    "home_module": "private-equity",
    "home_zone": "Z1",
    "contributed_by": "private-equity",
    "category": "Fund economics & structure",
    "appears_in": [
      "Z1",
      "Z5"
    ],
    "disambiguate_with": [],
    "status": "mapped"
  },
  {
    "id": "G13",
    "term": "Catch-up",
    "aliases": [],
    "quick_definition": "The waterfall step letting the GP collect profits until it holds its full ~20% once the hurdle is met.",
    "home_module": "private-equity",
    "home_zone": "Z1",
    "contributed_by": "private-equity",
    "category": "Fund economics & structure",
    "appears_in": [
      "Z1",
      "Z5"
    ],
    "disambiguate_with": [],
    "status": "mapped"
  },
  {
    "id": "G14",
    "term": "Clawback",
    "aliases": [],
    "quick_definition": "An LPA provision forcing the GP to return any carry it was overpaid across the fund's life.",
    "home_module": "private-equity",
    "home_zone": "Z1",
    "contributed_by": "private-equity",
    "category": "Fund economics & structure",
    "appears_in": [
      "Z1",
      "Z5"
    ],
    "disambiguate_with": [],
    "status": "mapped"
  },
  {
    "id": "G15",
    "term": "Capital call / Drawdown",
    "aliases": [],
    "quick_definition": "The GP's demand for a portion of committed capital as deals and fees arise.",
    "home_module": "private-equity",
    "home_zone": "Z1",
    "contributed_by": "private-equity",
    "category": "Fund economics & structure",
    "appears_in": [
      "Z1",
      "Z5"
    ],
    "disambiguate_with": [],
    "status": "mapped"
  },
  {
    "id": "G16",
    "term": "Committed / Contributed / Invested capital",
    "aliases": [],
    "quick_definition": "Capital pledged vs. capital actually called (paid-in) vs. capital deployed into deals.",
    "home_module": "private-equity",
    "home_zone": "Z1",
    "contributed_by": "private-equity",
    "category": "Fund economics & structure",
    "appears_in": [
      "Z1",
      "Z5"
    ],
    "disambiguate_with": [],
    "status": "mapped"
  },
  {
    "id": "G17",
    "term": "Dry powder",
    "aliases": [],
    "quick_definition": "Committed-but-not-yet-invested capital available to deploy (fund-level or industry-wide).",
    "home_module": "private-equity",
    "home_zone": "Z1",
    "contributed_by": "private-equity",
    "category": "Fund economics & structure",
    "appears_in": [
      "Z1",
      "Z3",
      "Z5"
    ],
    "disambiguate_with": [],
    "status": "mapped"
  },
  {
    "id": "G18",
    "term": "Vintage year",
    "aliases": [],
    "quick_definition": "The year a fund first closes and starts investing — the basis for peer benchmarking.",
    "home_module": "private-equity",
    "home_zone": "Z1",
    "contributed_by": "private-equity",
    "category": "Fund economics & structure",
    "appears_in": [
      "Z1",
      "Z5"
    ],
    "disambiguate_with": [],
    "status": "mapped"
  },
  {
    "id": "G19",
    "term": "Blind pool",
    "aliases": [],
    "quick_definition": "A fund whose investors commit before knowing which companies it will buy, trusting the mandate.",
    "home_module": "private-equity",
    "home_zone": "Z1",
    "contributed_by": "private-equity",
    "category": "Fund economics & structure",
    "appears_in": [
      "Z1",
      "Z5"
    ],
    "disambiguate_with": [],
    "status": "mapped"
  },
  {
    "id": "G20",
    "term": "LPA (Limited Partnership Agreement)",
    "aliases": [
      "Limited Partnership Agreement"
    ],
    "quick_definition": "The fund's governing contract — mandate, economics, governance, and LP–GP rights.",
    "home_module": "private-equity",
    "home_zone": "Z5",
    "contributed_by": "private-equity",
    "category": "Fund economics & structure",
    "appears_in": [
      "Z1",
      "Z3",
      "Z5"
    ],
    "disambiguate_with": [],
    "status": "mapped"
  },
  {
    "id": "G21",
    "term": "Commitment / Investment period",
    "aliases": [],
    "quick_definition": "The ~4–5-year window during which the GP can call capital for new investments.",
    "home_module": "private-equity",
    "home_zone": "Z1",
    "contributed_by": "private-equity",
    "category": "Fund economics & structure",
    "appears_in": [
      "Z1",
      "Z5"
    ],
    "disambiguate_with": [],
    "status": "mapped"
  },
  {
    "id": "G22",
    "term": "Holding period",
    "aliases": [],
    "quick_definition": "The ~3–7 years a fund owns a company, working to create value before exit.",